id,name,realm,rarity,levelScaling,levelCost_currency,levelCost_amount,effect1_type,effect1_arg1,effect1_arg2,effect2_type,effect2_arg1,effect2_arg2,effect3_type,effect3_arg1,effect3_arg2,effect4_type,effect4_arg1,effect4_arg2,effect5_type,effect5_arg1,effect5_arg2,effect6_type,effect6_arg1,effect6_arg2,effect7_type,effect7_arg1,effect7_arg2,effect8_type,effect8_arg1,effect8_arg2,specialEffect1_req_type,specialEffect1_req_amount,specialEffect1_type,specialEffect1_arg1,specialEffect1_arg2,specialEffect2_req_type,specialEffect2_req_amount,specialEffect2_type,specialEffect2_arg1,specialEffect2_arg2,description,quantity,tier,level
519,Mjölnir,5,legend,2,rune,100,currencyPerPoke,crystal,25000,,,,rarityOddsDivider,5,junk,rarityOddsDivider,5,basic,rarityOddsDivider,5,decent,rarityOddsDivider,5,fine,rarityOddsDivider,5,rare,,,,,,,,,,,,,,"Thor’s hammer, capable of leveling mountains.",0,0,1
520,Golden Fleece,5,legend,3,rune,75,,,,currencyPerSec,rune,5,rarityOddsDivider,1,junk,rarityOddsDivider,1,basic,rarityOddsDivider,1,decent,rarityOddsDivider,1,fine,rarityOddsDivider,2,junk,rarityOddsDivider,2,basic,,,,,,,,,,,Jason and the Argonauts quested for this powerful artifact.,0,0,1
521,Caduceus of Hermes,5,legend,3,rune,75,,,,currencyPerSec,rune,5,rarityOddsDivider,2,decent,rarityOddsDivider,2,fine,rarityOddsDivider,2,rare,rarityOddsDivider,3,junk,rarityOddsDivider,3,basic,rarityOddsDivider,3,decent,,,,,,,,,,,"Symbol of trade and negotiation, wielded by Hermes.",0,0,1
522,Aegis Shield,5,legend,3,rune,75,,,,currencyPerSec,rune,5,rarityOddsDivider,3,fine,rarityOddsDivider,3,rare,rarityOddsDivider,4,basic,rarityOddsDivider,4,decent,rarityOddsDivider,4,fine,rarityOddsDivider,4,rare,,,,,,,,,,,A powerful shield carried by Athena and Zeus.,0,0,1
523,Eye of Ra,5,legend,1.5,rune,50,currencyPerPoke,rune,25,,,,rarityOddsDivider,5,junk,rarityOddsDivider,5,basic,rarityOddsDivider,1,decent,rarityOddsDivider,2,decent,rarityOddsDivider,3,decent,rarityOddsDivider,4,decent,,,,,,,,,,,An ancient Egyptian symbol of protection and royal power.,0,0,1
524,Staff of the Magi,5,legend,5,rune,50,currencyPerPoke,crystal,30000,currencyPerSec,crystal,100,cooldownDivider,,,maxCardsPerPoke,,,minCardsPerPoke,,,rarityOddsDivider,2,basic,rarityOddsDivider,3,basic,rarityOddsDivider,4,basic,,,,,,,,,,,An artifact said to channel immense magical energy.,0,0,1
525,Enchanted Cloak,5,legend,2,rune,50,currencyPerPoke,rune,50,,,,rarityOddsDivider,5,junk,rarityOddsDivider,5,basic,rarityOddsDivider,5,decent,rarityOddsDivider,5,fine,rarityOddsDivider,5,rare,rarityOddsDivider,5,legendary,,,,,,,,,,,Invisibility cloaks appear in legends from many cultures.,0,0,1
526,Sorcerer’s Chalice,5,legend,5,rune,100,currencyPerPoke,rune,100,currencyPerSec,crystal,100,maxCardsPerPoke,,,minCardsPerPoke,,,rarityOddsDivider,1,basic,rarityOddsDivider,2,basic,rarityOddsDivider,3,basic,rarityOddsDivider,4,basic,,,,,,,,,,,A cup said to grant insight or eternal youth.,0,0,1
527,Cup of Eternal Youth,5,mythic,3.5,rune,500,currencyPerPoke,rune,1000,currencyPerSec,rune,25,cooldownDivider,,,rarityOddsDivider,1,fine,rarityOddsDivider,2,rare,rarityOddsDivider,3,rare,rarityOddsDivider,4,rare,rarityOddsDivider,5,rare,tier,10,currencyPerSecMultiplier,rune,10,,,,,,"Sought by many, this relic offers everlasting vitality.",0,0,1
601,Asteroid,6,basic,2,stone,10,currencyPerPoke,stone,10,,,,rarityOddsDivider,6,basic,,,,,,,,,,,,,,,,,,,,,,,,,,Asteroids in our solar system are remnants from its formation over 4.6 billion years ago.,0,0,1
602,Comet,6,basic,5,stone,25,,,,currencyPerSec,stone,10,cooldownDivider,,,,,,,,,,,,,,,,,,,,,,,,,,,,Some comets complete their orbits around the Sun in thousands of years.,0,0,1
603,Hoba,6,decent,2,stone,40,currencyPerPoke,stone,50,,,,rarityOddsDivider,6,basic,rarityOddsDivider,1,junk,,,,,,,,,,,,,,,,,,,,,,,The Hoba meteorite is the largest known intact meteorite on Earth at 60 tons.,0,0,1
604,Earth,6,decent,4.5,stone,200,currencyPerPoke,stone,75,,,,cooldownDivider,,,rarityOddsDivider,1,junk,rarityOddsDivider,2,junk,rarityOddsDivider,3,junk,,,,,,,tier,3,flatCurrencyPerPoke,stone,2500,,,,,,Earth is the only known planet with liquid water on its surface and life.,0,0,1
605,Mars,6,decent,2.5,stone,25,currencyPerPoke,stone,50,currencyPerSec,stone,5,rarityOddsDivider,1,basic,rarityOddsDivider,2,basic,,,,,,,,,,,,,,,,,,,,,,,Mars has the largest dust storms in our solar system sometimes covering the entire planet.,0,0,1
606,Saturn,6,decent,5,stone,100,currencyPerPoke,stone,100,,,,maxCardsPerPoke,,,rarityOddsDivider,6,basic,rarityOddsDivider,6,decent,,,,,,,,,,,,,,,,,,,,Saturn's rings are made mostly of ice particles with some rocky debris and dust.,0,0,1
607,Sun,6,fine,4.5,stone,200,currencyPerPoke,stone,300,,,,cooldownDivider,,,rarityOddsDivider,5,junk,rarityOddsDivider,5,basic,rarityOddsDivider,5,decent,,,,,,,level,12,flatCurrencyPerSecond,cosmic_ray,1,,,,,,The Sun accounts for 99.86% of the mass in our solar system.,0,0,1
608,Proxima Centauri,6,fine,2,stone,80,currencyPerPoke,stone,250,,,,rarityOddsDivider,6,basic,rarityOddsDivider,6,decent,rarityOddsDivider,5,basic,,,,,,,,,,,,,,,,,,,,Proxima Centauri is the closest star to our solar system at just 4.2 light-years away.,0,0,1
609,Sirius,6,rare,2,stone,100,currencyPerPoke,stone,1000,,,,rarityOddsDivider,6,basic,rarityOddsDivider,6,decent,rarityOddsDivider,6,fine,,,,,,,,,,,,,,,,,,,,Sirius is twice as massive as our Sun and 25 times more luminous.,0,0,1
610,Betelgeuse,6,rare,2.5,stone,50,currencyPerPoke,stone,1000,currencyPerSec,stone,25,rarityOddsDivider,4,basic,rarityOddsDivider,4,decent,rarityOddsDivider,4,fine,rarityOddsDivider,6,decent,,,,,,,,,,,,,,,,,Betelgeuse is so large that if placed in our solar system it would extend past Jupiter's orbit.,0,0,1
611,Orion Nebula,6,rare,4,stone,200,currencyPerPoke,stone,1500,,,,cooldownDivider,,,rarityOddsDivider,4,basic,rarityOddsDivider,5,basic,rarityOddsDivider,6,basic,,,,,,,,,,,,,,,,,The Orion Nebula is visible to the naked eye and is 24 light-years across.,0,0,1
612,Crab Nebula,6,rare,5,stone,150,currencyPerPoke,stone,1500,currencyPerSec,stone,25,minCardsPerPoke,,,maxCardsPerPoke,,,rarityOddsDivider,3,decent,rarityOddsDivider,6,decent,rarityOddsDivider,6,rare,,,,,,,,,,,,,,The Crab Nebula is the remnant of a supernova observed in 1054 AD.,0,0,1
613,Milky Way,6,epic,1.5,cosmic_ray,5,currencyPerPoke,stone,5000,,,,rarityOddsDivider,6,basic,rarityOddsDivider,6,basic,rarityOddsDivider,6,decent,rarityOddsDivider,6,fine,rarityOddsDivider,6,rare,rarityOddsDivider,5,decent,,,,,,,,,,,Our Milky Way galaxy contains between 100-400 billion stars.,0,0,1
614,Andromeda Galaxy,6,epic,4,cosmic_ray,10,currencyPerPoke,cosmic_ray,1,currencyPerSec,stone,50,cooldownDivider,,,rarityOddsDivider,1,junk,rarityOddsDivider,2,junk,rarityOddsDivider,3,junk,rarityOddsDivider,4,basic,rarityOddsDivider,5,junk,,,,,,,,,,,The Andromeda Galaxy is on a collision course with our Milky Way and will merge in about 4.5 billion years.,0,0,1
615,Triangulum Galaxy,6,epic,1.5,cosmic_ray,10,currencyPerPoke,stone,5000,,,,rarityOddsDivider,1,basic,rarityOddsDivider,2,basic,rarityOddsDivider,3,basic,rarityOddsDivider,4,basic,rarityOddsDivider,5,basic,rarityOddsDivider,6,basic,,,,,,,,,,,The Triangulum Galaxy is the third-largest galaxy in our Local Group after Andromeda and the Milky Way.,0,0,1
616,Sagittarius A*,6,legend,5,cosmic_ray,25,currencyPerPoke,cosmic_ray,10,currencyPerSec,cosmic_ray,1,maxCardsPerPoke,,,rarityOddsDivider,1,decent,rarityOddsDivider,2,decent,rarityOddsDivider,3,decent,rarityOddsDivider,4,decent,rarityOddsDivider,5,decent,,,,,,,,,,,Sagittarius A* is the supermassive black hole at the center of our Milky Way galaxy.,0,0,1
617,Messier 87 Black Hole,6,legend,5,cosmic_ray,25,currencyPerPoke,cosmic_ray,5,,,,cooldownDivider,,,maxCardsPerPoke,,,rarityOddsDivider,1,fine,rarityOddsDivider,2,fine,rarityOddsDivider,3,fine,rarityOddsDivider,4,fine,,,,,,,,,,,The M87 black hole was the first ever to be directly imaged by the Event Horizon Telescope in 2019.,0,0,1
618,Quasar 3C 273,6,mythic,3.5,cosmic_ray,500,currencyPerPoke,cosmic_ray,500,currencyPerSec,cosmic_ray,20,cooldownDivider,,,rarityOddsDivider,2,epic,rarityOddsDivider,2,rare,rarityOddsDivider,3,rare,rarityOddsDivider,4,rare,rarityOddsDivider,5,rare,tier,10,currencyPerSecMultiplier,cosmic_ray,10,,,,,,Quasar 3C 273 is one of the brightest objects in the universe and is powered by a supermassive black hole.,0,0,1
701,Mouse,7,junk,1.5,tooth,5,currencyPerPoke,tooth,1,,,,,,,,,,,,,,,,,,,,,,,,,,,,,,,,A mouse's teeth never stop growing throughout its entire life.,0,0,1
702,Rat,7,junk,2,tooth,5,currencyPerPoke,tooth,1,,,,rarityOddsDivider,7,junk,,,,,,,,,,,,,,,,,,,,,,,,,,Rats are so intelligent they can learn their names and come when called.,0,0,1
703,Rabbit,7,junk,2,tooth,5,currencyPerPoke,tooth,1,,,,rarityOddsDivider,7,junk,,,,,,,,,,,,,,,,,,,,,,,,,,Rabbits' teeth grow up to 5 inches per year and must be constantly worn down.,0,0,1
704,Pixie,7,basic,2.5,tooth,25,,,,currencyPerSec,tooth,2,rarityOddsDivider,7,junk,rarityOddsDivider,7,basic,,,,,,,,,,,,,level,15,flatCurrencyPerPoke,pollen,10000,,,,,,In folklore pixies were known for leading travelers astray in the wilderness.,0,0,1
705,Fox,7,basic,2,tooth,40,currencyPerPoke,tooth,10,,,,rarityOddsDivider,7,junk,rarityOddsDivider,6,basic,,,,,,,,,,,,,,,,,,,,,,,Foxes can hear rodents digging underground from nearly 40 feet away.,0,0,1
706,Wolf,7,basic,2,tooth,40,currencyPerPoke,tooth,10,,,,rarityOddsDivider,7,junk,rarityOddsDivider,7,basic,,,,,,,,,,,,,,,,,,,,,,,Wolves can smell prey up to 1.5 miles away even in dense forests.,0,0,1
707,Bear,7,decent,2,tooth,50,currencyPerPoke,tooth,50,,,,rarityOddsDivider,7,junk,rarityOddsDivider,7,basic,rarityOddsDivider,5,basic,,,,,,,,,,,,,,,,,,,,Bears can smell food from over 18 miles away and have better noses than bloodhounds.,0,0,1
708,Lion,7,decent,4.5,tooth,50,currencyPerPoke,tooth,75,,,,cooldownDivider,,,rarityOddsDivider,7,junk,rarityOddsDivider,7,basic,,,,,,,,,,,,,,,,,,,,A lion's roar can be heard from up to 5 miles away.,0,0,1
709,Leopard,7,decent,1.5,tooth,50,currencyPerPoke,tooth,50,,,,rarityOddsDivider,7,junk,,,,,,,,,,,,,,,,,,,,,,,,,,"Leopards can carry prey twice their weight up into trees, even full-grown antelopes.",0,0,1
710,Panther,7,decent,2.5,tooth,25,,,,currencyPerSec,tooth,5,rarityOddsDivider,7,junk,rarityOddsDivider,7,basic,,,,,,,,,,,,,,,,,,,,,,,Panthers actually aren't a separate species but are black variants of leopards or jaguars.,0,0,1
711,Tiger,7,fine,2,tooth,50,currencyPerPoke,tooth,250,,,,rarityOddsDivider,7,junk,rarityOddsDivider,7,basic,rarityOddsDivider,7,decent,,,,,,,,,,,,,,,,,,,,Tigers have striped skin beneath their fur—not just striped fur.,0,0,1
712,Dire Wolf,7,fine,4.5,tooth,50,currencyPerPoke,tooth,400,,,,cooldownDivider,,,rarityOddsDivider,3,basic,rarityOddsDivider,4,basic,rarityOddsDivider,5,basic,,,,,,,,,,,,,,,,,Dire wolves were 25% larger than modern wolves and went extinct about 10000 years ago.,0,0,1
713,Griffin,7,fine,2.5,feather,10,currencyPerPoke,tooth,250,currencyPerSec,tooth,10,rarityOddsDivider,3,fine,rarityOddsDivider,4,decent,,,,,,,,,,,,,,,,,,,,,,,Griffins were believed to guard massive gold deposits in ancient mountains.,0,0,1
714,Unicorn,7,fine,2,tooth,50,currencyPerPoke,tooth,250,,,,rarityOddsDivider,7,junk,rarityOddsDivider,7,basic,rarityOddsDivider,6,basic,,,,,,,,,,,,,,,,,,,,Unicorn horns were believed to purify water and neutralize poison in medieval times.,0,0,1
715,Pegasus,7,rare,5,feather,10,currencyPerPoke,feather,10,,,,maxCardsPerPoke,,,rarityOddsDivider,7,basic,rarityOddsDivider,5,junk,rarityOddsDivider,6,fine,,,,,,,,,,,,,,,,,In Greek mythology Pegasus was born from the blood of Medusa when Perseus beheaded her.,0,0,1
716,Centaur,7,rare,2,tooth,50,currencyPerPoke,tooth,1000,,,,rarityOddsDivider,7,junk,rarityOddsDivider,7,basic,rarityOddsDivider,7,decent,,,,,,,,,,,,,,,,,,,,Centaurs were exceptional astronomers in Greek mythology who taught humans about the stars.,0,0,1
717,Satyr,7,rare,4,tooth,50,,,,currencyPerSec,tooth,40,cooldownDivider,,,rarityOddsDivider,6,basic,rarityOddsDivider,6,fine,,,,,,,,,,,,,,,,,,,,Satyrs were companions of Dionysus who could play panpipes so beautifully they could enchant anyone who heard.,0,0,1
718,Minotaur,7,rare,2,tooth,50,currencyPerPoke,tooth,1000,,,,rarityOddsDivider,7,junk,rarityOddsDivider,7,basic,rarityOddsDivider,7,decent,rarityOddsDivider,5,decent,,,,,,,,,,,,,,,,,The original Minotaur lived in a labyrinth designed by Daedalus that was so complex no one could escape.,0,0,1
719,Cerberus,7,rare,2.5,tooth,25,currencyPerPoke,tooth,1000,currencyPerSec,tooth,25,rarityOddsDivider,7,junk,rarityOddsDivider,7,fine,,,,,,,,,,,,,,,,,,,,,,,Cerberus had three heads and a serpent for a tail guarding the gates of the Underworld.,0,0,1
720,Basilisk,7,rare,2,royal_jelly,10,currencyPerPoke,tooth,1000,,,,rarityOddsDivider,2,junk,rarityOddsDivider,2,basic,rarityOddsDivider,2,decent,rarityOddsDivider,2,fine,rarityOddsDivider,2,rare,,,,,,,,,,,,,,Medieval legends claimed basilisks could kill with just a glance or breath.,0,0,1
721,Chimera,7,epic,2,tooth,50,currencyPerPoke,tooth,5000,,,,rarityOddsDivider,7,junk,rarityOddsDivider,7,basic,rarityOddsDivider,7,decent,rarityOddsDivider,7,fine,rarityOddsDivider,4,decent,rarityOddsDivider,4,rare,,,,,,,,,,,"The Chimera had the head of a lion, body of a goat, and tail of a serpent—each representing past, present, and future.",0,0,1
722,Sphinx,7,epic,2.5,feather,5,currencyPerPoke,tooth,5000,,feather,3,rarityOddsDivider,7,basic,rarityOddsDivider,7,decent,rarityOddsDivider,3,decent,rarityOddsDivider,3,fine,rarityOddsDivider,3,rare,,,,,,,,,,,,,,"The Sphinx's famous riddle asked travelers ""What walks on four feet in the morning, two in the afternoon, and three at night?""",0,0,1
723,Hydra,7,epic,4,royal_jelly,10,currencyPerPoke,tooth,6000,,,,cooldownDivider,,,rarityOddsDivider,7,decent,rarityOddsDivider,2,decent,rarityOddsDivider,7,fine,rarityOddsDivider,3,decent,,,,level,9,flatCurrencyPerPoke,tooth,1000000,,,,,,For each head cut from the Hydra two more would grow in its place.,0,0,1
724,Cockatrice,7,epic,5,royal_jelly,10,currencyPerPoke,tooth,7500,,,,minCardsPerPoke,,,maxCardsPerPoke,,,rarityOddsDivider,7,fine,rarityOddsDivider,7,rare,rarityOddsDivider,4,decent,,,,,,,,,,,,,,The cockatrice was believed to be born from a rooster's egg incubated by a serpent or toad.,0,0,1
725,Tarrasque,7,epic,2.5,royal_jelly,5,currencyPerPoke,tooth,5000,currencyPerSec,tooth,75,rarityOddsDivider,7,junk,rarityOddsDivider,6,decent,rarityOddsDivider,5,fine,rarityOddsDivider,6,decent,rarityOddsDivider,6,fine,,,,,,,,,,,,,,"The Tarrasque was a legendary dragon-like creature from Provence, France that could only be tamed by a saint.",0,0,1
726,Chrysomallos,7,legend,2,tooth,25,currencyPerPoke,tooth,25000,,,,rarityOddsDivider,7,junk,rarityOddsDivider,7,basic,rarityOddsDivider,7,decent,rarityOddsDivider,7,fine,rarityOddsDivider,5,fine,,,,tier,5,flatCurrencyPerSecond,rune,25000,,,,,,Chrysomallos was the golden-fleeced ram in Greek mythology that could fly and speak human language.,0,0,1
727,Manticore,7,legend,2,tooth,25,currencyPerPoke,tooth,25000,,,,rarityOddsDivider,7,basic,rarityOddsDivider,7,decent,rarityOddsDivider,7,fine,rarityOddsDivider,7,rare,rarityOddsDivider,5,fine,,,,,,,,,,,,,,"The manticore had the body of a lion, face of a human, and tail of a scorpion with poisonous spines.",0,0,1
728,Wyvern,7,legend,3.5,tooth,10,,,,currencyPerSec,tooth,150,cooldownDivider,,,rarityOddsDivider,2,junk,rarityOddsDivider,3,junk,rarityOddsDivider,4,basic,rarityOddsDivider,7,decent,,,,,,,,,,,,,,"Unlike dragons, wyverns have only two legs and use their wings as forelegs when on the ground.",0,0,1
729,Ancient Dragon,7,legend,1.5,royal_jelly,10,currencyPerPoke,tooth,25000,,,,rarityOddsDivider,2,basic,rarityOddsDivider,3,basic,rarityOddsDivider,4,basic,rarityOddsDivider,5,basic,rarityOddsDivider,6,basic,rarityOddsDivider,7,basic,,,,,,,,,,,Ancient dragons were believed to be as old as the world itself and repositories of all knowledge.,0,0,1
730,Leviathan,7,legend,5,pearl,10,currencyPerPoke,pearl,20,,pearl,5,minCardsPerPoke,,,maxCardsPerPoke,,,rarityOddsDivider,2,fine,rarityOddsDivider,7,rare,rarityOddsDivider,7,epic,rarityOddsDivider,6,epic,,,,,,,,,,,The Leviathan is described in the Bible as a massive sea monster that no human could subdue.,0,0,1
731,Kraken,7,legend,5,pearl,25,currencyPerPoke,royal_jelly,20,currencyPerSec,royal_jelly,5,maxCardsPerPoke,,,rarityOddsDivider,2,decent,rarityOddsDivider,3,decent,rarityOddsDivider,4,decent,rarityOddsDivider,5,decent,rarityOddsDivider,6,decent,,,,,,,,,,,Sailors once believed the Kraken could create whirlpools that could sink entire fleets of ships.,0,0,1
732,Ziz,7,mythic,5,feather,25,currencyPerPoke,feather,100,,,,cooldownDivider,,,maxCardsPerPoke,,,rarityOddsDivider,2,fine,rarityOddsDivider,3,fine,rarityOddsDivider,4,fine,rarityOddsDivider,5,fine,,,,,,,,,,,"In Jewish mythology, Ziz was a massive bird so large its wingspan could block out the sun.",0,0,1
733,Quetzalcoatl,7,mythic,3.5,feather,25,currencyPerPoke,tooth,250000,currencyPerSec,royal_jelly,20,cooldownDivider,,,rarityOddsDivider,2,rare,rarityOddsDivider,3,rare,rarityOddsDivider,4,rare,rarityOddsDivider,7,basic,rarityOddsDivider,7,decent,,,,,,,,,,,"Quetzalcoatl, the ""Feathered Serpent"", was worshipped as a creator deity in Mesoamerican cultures.",0,0,1
734,Fenrir,7,mythic,5,tooth,10,currencyPerPoke,royal_jelly,50,currencyPerSec,tooth,500,maxCardsPerPoke,,,rarityOddsDivider,3,junk,rarityOddsDivider,4,basic,rarityOddsDivider,5,junk,rarityOddsDivider,6,basic,rarityOddsDivider,7,junk,,,,,,,,,,,"In Norse mythology, Fenrir was a monstrous wolf destined to kill Odin during Ragnarök.",0,0,1
735,Jörmungandr,7,mythic,5,pearl,10,currencyPerPoke,royal_jelly,100,,,,cooldownDivider,,,maxCardsPerPoke,,,rarityOddsDivider,3,rare,rarityOddsDivider,4,rare,rarityOddsDivider,5,rare,rarityOddsDivider,6,rare,,,,,,,,,,,Jörmungandr was a sea serpent so large it encircled the entire world and grasped its own tail.,0,0,1
736,Bahamut,7,exotic,3,royal_jelly,10,currencyPerPoke,royal_jelly,1000,currencyPerSec,royal_jelly,100,cooldownDivider,,,rarityOddsDivider,2,epic,rarityOddsDivider,3,epic,rarityOddsDivider,4,epic,rarityOddsDivider,5,legend,rarityOddsDivider,6,epic,,,,,,,,,,,"In Arabian mythology, Bahamut was a massive fish that supported the world on its back.",0,0,1
801,IdleOn,8,junk,1.5,coin,10,currencyPerPoke,coin,1,,,,,,,,,,,,,,,,,,,,,,,,,,,,,,,,An pay-to-win idle MMO that's more grind than game.,0,0,1
802,AdVenture Capitalist,8,junk,1.5,coin,10,currencyPerPoke,coin,1,,,,,,,,,,,,,,,,,,,,,,,,,,,,,,,,"The OG tap-to-profit simulator, with zero interesting mechanics.",0,0,1
803,Adventure Communist,8,junk,1.5,coin,10,currencyPerPoke,coin,1,,,,,,,,,,,,,,,,,,,,,,,,,,,,,,,,A blatant reskin of its predecessor with no new mechanics added.,0,0,1
804,Tap Tycoon,8,junk,2,coin,15,currencyPerPoke,coin,1,,,,rarityOddsDivider,8,junk,,,,,,,,,,,,,,,,,,,,,,,,,,Tycoon mechanics with a side of tapping. Good for falling asleep.,0,0,1
805,Idle Miner Tycoon,8,junk,2,coin,15,currencyPerPoke,coin,1,,,,rarityOddsDivider,8,junk,,,,,,,,,,,,,,,,,,,,,,,,,,Digging for profit... endlessly.,0,0,1
806,Bitcoin Billionaire,8,junk,2.5,coin,25,,,,currencyPerSec,coin,1,,,,,,,,,,,,,,,,,,,,,,,,,,,,,"Mine coins, time travel, repeat. How long before you uninstall?",0,0,1
807,Make It Rain,8,junk,2.5,coin,25,,,,currencyPerSec,coin,1,,,,,,,,,,,,,,,,,,,,,,,,,,,,,Just flick your screen and get rich! Pure nonsense.,0,0,1
808,Idle Tap Zoo,8,junk,2.5,coin,25,,,,currencyPerSec,coin,1,,,,,,,,,,,,,,,,,,,,,,,,,,,,,Collect adorable animals while doing nothing. And never feel like you did anything.,0,0,1
809,Banana,8,junk,3,coin,30,currencyPerPoke,coin,1,currencyPerSec,coin,1,rarityOddsDivider,8,junk,,,,,,,,,,,,,,,,level,10,flatCurrencyPerPoke,stone,1,,,,,,You don’t know why you tapped it. But you did.,0,0,1
810,Firestone Online,8,basic,2,coin,20,currencyPerPoke,coin,10,,,,rarityOddsDivider,8,basic,rarityOddsDivider,7,basic,rarityOddsDivider,6,basic,,,,,,,,,,,,,,,,,,,,Basic fantasy idle with light RPG elements.,0,0,1
811,Idle Heroes,8,basic,2,coin,20,currencyPerPoke,coin,10,,,,rarityOddsDivider,8,junk,rarityOddsDivider,7,junk,rarityOddsDivider,6,basic,,,,,,,,,,,,,,,,,,,,Collection-based idle RPG with gacha elements and paywalls.,0,0,1
812,Idle Apocalypse,8,basic,2,coin,20,currencyPerPoke,coin,10,,,,rarityOddsDivider,8,junk,rarityOddsDivider,5,junk,rarityOddsDivider,4,basic,,,,,,,,,,,,,,,,,,,,Post-apocalyptic tower-themed idle.,0,0,1
813,Almost A Hero,8,basic,2.5,coin,50,,,,currencyPerSec,coin,2,rarityOddsDivider,3,junk,rarityOddsDivider,5,junk,,,,,,,,,,,,,,,,,,,,,,,Roguelike mechanics meet idle hero training.,0,0,1
814,Idle Balls,8,basic,2.5,coin,50,,,,currencyPerSec,coin,2,rarityOddsDivider,4,basic,rarityOddsDivider,6,basic,,,,,,,,,,,,,,,,,,,,,,,Physics-based ball dropper meets idle scaling.,0,0,1
815,Exponential Idle,8,basic,5,coin,25,currencyPerPoke,coin,15,,,,maxCardsPerPoke,,,rarityOddsDivider,6,basic,,,,,,,,,,,,,,,,,,,,,,,Math-driven idle focused on equation growth.,0,0,1
816,Idle Skilling,8,basic,5,coin,25,currencyPerPoke,coin,15,,,,maxCardsPerPoke,,,rarityOddsDivider,7,junk,,,,,,,,,,,,,,,,,,,,,,,Multi-layered idle with lots of systems.,0,0,1
817,Mr Mine,8,basic,5,coin,50,currencyPerPoke,coin,15,,,,cooldownDivider,,,rarityOddsDivider,8,junk,rarityOddsDivider,8,basic,,,,,,,,,,,,,,,,,,,,Dig and upgrade through oddities underground.,0,0,1
818,Kittens Game,8,decent,1.5,coin,25,currencyPerPoke,coin,50,,,,rarityOddsDivider,8,junk,,,,,,,,,,,,,,,,,,,,,,,,,,Civ-building with deep resource strategy.,0,0,1
819,A Dark Room,8,decent,1.5,coin,25,currencyPerPoke,coin,50,,,,rarityOddsDivider,8,basic,,,,,,,,,,,,,,,,,,,,,,,,,,Narrative-driven idle with eerie tone.,0,0,1
820,Universal Paperclips,8,decent,1.5,coin,25,currencyPerPoke,coin,50,,,,rarityOddsDivider,4,decent,,,,,,,,,,,,,,,,,,,,,,,,,,From paperclip to AI dominance.,0,0,1
821,Cell to Singularity,8,decent,2.5,coin,20,,,,currencyPerSec,coin,5,rarityOddsDivider,5,junk,rarityOddsDivider,5,basic,,,,,,,,,,,,,,,,,,,,,,,Evolution from DNA to tech singularity.,0,0,1
822,Realm Grinder,8,decent,2.5,coin,20,,,,currencyPerSec,coin,5,rarityOddsDivider,6,basic,rarityOddsDivider,6,decent,,,,,,,,,,,,,,,,,,,,,,,Align with factions and go deeper in this snoozefest.,0,0,1
823,Tap Titans,8,decent,5,coin,25,currencyPerPoke,coin,75,,,,maxCardsPerPoke,,,rarityOddsDivider,8,junk,rarityOddsDivider,7,decent,,,,,,,,,,,,,,,,,,,,Flashy clicker with sword-wielding heroes.,0,0,1
824,Download RAM Idle,8,decent,5,coin,25,,,,currencyPerSec,coin,8,maxCardsPerPoke,,,rarityOddsDivider,8,junk,rarityOddsDivider,6,decent,,,,,,,,,,,,,,,,,,,,Absurdist idle about downloading RAM.,0,0,1
825,Leafblower Revolution,8,decent,4.5,coin,10,currencyPerPoke,coin,60,,,,cooldownDivider,,,rarityOddsDivider,8,basic,rarityOddsDivider,8,decent,,,,,,,,,,,,,,,,,,,,"Blow leaves and ascend. Yes, really.",0,0,1
826,Increlution,8,fine,2,coin,10,currencyPerPoke,coin,250,,,,rarityOddsDivider,8,junk,rarityOddsDivider,8,basic,rarityOddsDivider,8,decent,,,,,,,,,,level,15,flatCurrencyPerPoke,coin,50000,,,,,,Strategic idle with evolutionary theme.,0,0,1
827,Melvor Idle,8,fine,2,coin,10,currencyPerPoke,coin,250,,,,rarityOddsDivider,7,junk,rarityOddsDivider,7,basic,rarityOddsDivider,7,decent,,,,,,,,,,,,,,,,,,,,RuneScape-style idle with stats and skills.,0,0,1
828,Idle Wizard,8,fine,2,coin,10,currencyPerPoke,coin,250,,,,rarityOddsDivider,6,basic,rarityOddsDivider,6,decent,rarityOddsDivider,6,fine,,,,,,,,,,,,,,,,,,,,"Choose magic paths, climb spell trees.",0,0,1
829,Midnight Idle,8,fine,2,coin,10,currencyPerPoke,coin,250,,,,rarityOddsDivider,5,junk,rarityOddsDivider,5,basic,rarityOddsDivider,5,decent,,,,,,,,,,,,,,,,,,,,Darkness and rituals in idle form.,0,0,1
830,Time Clickers,8,fine,2.5,coin,20,,,,currencyPerSec,coin,10,rarityOddsDivider,8,basic,rarityOddsDivider,7,basic,rarityOddsDivider,6,basic,rarityOddsDivider,5,basic,,,,,,,,,,,,,,,,,FPS meets idle with color-coded chaos.,0,0,1
831,Idle Breakout,8,fine,2.5,coin,20,,,,currencyPerSec,coin,10,rarityOddsDivider,4,basic,rarityOddsDivider,3,basic,rarityOddsDivider,2,basic,rarityOddsDivider,1,basic,,,,,,,,,,,,,,,,,Brick-breaking arcade merges with idle.,0,0,1
832,What Lurks Below,8,fine,5,coin,10,,,,currencyPerSec,coin,15,cooldownDivider,,,maxCardsPerPoke,,,minCardsPerPoke,,,rarityOddsDivider,8,fine,,,,,,,,,,,,,,,,,Horror-themed idle with deep digging.,0,0,1
833,Idle Slayer,8,rare,1.5,coin,15,currencyPerPoke,coin,1000,,,,rarityOddsDivider,8,fine,rarityOddsDivider,8,decent,,,,,,,,,,,,,,,,,,,,,,,Platforming and idle? It works.,0,0,1
834,Swarm Simulator,8,rare,1.5,coin,15,currencyPerPoke,coin,1000,,,,rarityOddsDivider,8,fine,rarityOddsDivider,8,basic,,,,,,,,,,,,,,,,,,,,,,,Swarm up. Multiply. Exponentiate.,0,0,1
835,Farmer Against Potatoes,8,rare,2.5,coin,20,,,,currencyPerSec,coin,25,rarityOddsDivider,8,junk,rarityOddsDivider,8,basic,rarityOddsDivider,8,decent,,,,,,,,,,,,,,,,,,,,It’s weird. It’s good.,0,0,1
836,Synergism,8,rare,5,coin,50,currencyPerPoke,coin,1500,,,,maxCardsPerPoke,,,rarityOddsDivider,5,junk,rarityOddsDivider,6,basic,rarityOddsDivider,7,junk,,,,,,,,,,,,,,,,,Math-heavy idle with corruption.,0,0,1
837,Idle Loops,8,rare,4,coin,40,,,,currencyPerSec,coin,40,cooldownDivider,,,rarityOddsDivider,8,rare,rarityOddsDivider,8,fine,rarityOddsDivider,8,junk,,,,,,,,,,,,,,,,,Time loop idle built around code.,0,0,1
838,Shark Incremental,8,rare,4,coin,40,,,,currencyPerSec,coin,40,cooldownDivider,,,rarityOddsDivider,8,rare,rarityOddsDivider,8,fine,rarityOddsDivider,8,basic,,,,,,,,,,,,,,,,,An idle empire under the sea.,0,0,1
839,Egg Inc.,8,epic,1.5,coin,10,currencyPerPoke,coin,5000,,,,rarityOddsDivider,1,decent,rarityOddsDivider,2,decent,rarityOddsDivider,2,fine,rarityOddsDivider,2,rare,,,,,,,,,,,,,,,,,Build the chicken egg multiverse.,0,0,1
