id,name,realm,rarity,levelScaling,levelCost_currency,levelCost_amount,effect1_type,effect1_arg1,effect1_arg2,effect2_type,effect2_arg1,effect2_arg2,effect3_type,effect3_arg1,effect3_arg2,effect4_type,effect4_arg1,effect4_arg2,effect5_type,effect5_arg1,effect5_arg2,effect6_type,effect6_arg1,effect6_arg2,effect7_type,effect7_arg1,effect7_arg2,effect8_type,effect8_arg1,effect8_arg2,specialEffect1_req_type,specialEffect1_req_amount,specialEffect1_type,specialEffect1_arg1,specialEffect1_arg2,specialEffect2_req_type,specialEffect2_req_amount,specialEffect2_type,specialEffect2_arg1,specialEffect2_arg2,description,quantity,tier,level
101,Pebble,1,junk,1.5,stone,10,currencyPerPoke,stone,1,,,,,,,,,,,,,,,,,,,,,,,,,,,,,,,,Pebbles can form protective barriers called pebble beaches that shield shorelines from strong waves.,0,0,1
102,Stone Fragment,1,junk,1.5,stone,10,currencyPerPoke,stone,1,,,,,,,,,,,,,,,,,,,,,,,,,,,,,,,,Some stone fragments contain tiny fossils that are millions of years old!,0,0,1
103,Flint,1,junk,2,stone,20,currencyPerPoke,stone,1,,,,rarityOddsDivider,1,junk,,,,,,,,,,,,,,,,,,,,,,,,,,Flint was used for tools and fire-starting by early humans over 2 million years ago.,0,0,1
104,Coal,1,junk,2,stone,20,currencyPerPoke,stone,1,,,,rarityOddsDivider,1,junk,,,,,,,,,,,,,,,,,,,,,,,,,,Coal is formed from ancient plants that lived over 300 million years ago!,0,0,1
105,Iron Ore,1,junk,5,stone,10,currencyPerPoke,stone,1,,,,cooldownDivider,,,,,,,,,,,,,,,,,,,,,,,,,,,,Iron ore mining dates back more than 4000 years to ancient Egypt.,0,0,1
106,Copper Nugget,1,junk,2.5,stone,25,,,,currencyPerSec,stone,1,,,,,,,,,,,,,,,,,,,,,,,,,,,,,"Copper was the first metal ever used by humans, over 10,000 years ago.",0,0,1
107,Limestone,1,junk,2.5,stone,25,,,,currencyPerSec,stone,1,,,,,,,,,,,,,,,,,,,,,,,,,,,,,Limestone makes up most coral reefs and contains the skeletons of ancient sea life.,0,0,1
108,Sandstone,1,junk,2,stone,50,currencyPerPoke,stone,1,,,,rarityOddsDivider,1,basic,,,,,,,,,,,,,,,,,,,,,,,,,,Sandstone can form stunning canyons like Antelope Canyon in Arizona.,0,0,1
109,Granite Chunk,1,basic,2,stone,50,currencyPerPoke,stone,10,,,,rarityOddsDivider,1,junk,rarityOddsDivider,1,basic,,,,,,,,,,,,,level,20,flatCurrencyPerSecond,stone,1000,,,,,,Granite makes up most of Earth’s continental crust and can be over a billion years old.,0,0,1
110,Shale,1,basic,2,stone,50,currencyPerPoke,stone,10,,,,rarityOddsDivider,1,junk,rarityOddsDivider,1,basic,,,,,,,,,,,,,,,,,,,,,,,"Shale layers can trap natural gas and oil, shaping modern fracking.",0,0,1
111,Marble Slab,1,basic,5,stone,100,,,,currencyPerSec,stone,10,maxCardsPerPoke,,,rarityOddsDivider,1,junk,,,,,,,,,,,,,,,,,,,,,,,Marble is metamorphosed limestone and was used by Michelangelo to carve David.,0,0,1
112,Quartz Crystal,1,decent,2,stone,30,currencyPerPoke,stone,50,,,,rarityOddsDivider,1,junk,rarityOddsDivider,1,basic,rarityOddsDivider,1,decent,,,,,,,,,,tier,6,merchantPriceReduction,0.1,,,,,,,Quartz powers timepieces—its vibrations keep watches ticking!,0,0,1
113,Basalt Boulder,1,decent,4.5,stone,100,currencyPerPoke,stone,75,,,,cooldownDivider,,,rarityOddsDivider,1,junk,,,,,,,,,,,,,,,,,,,,,,,Basalt forms the vast ocean floors and the Giant’s Causeway in Ireland.,0,0,1
114,Obsidian Shard,1,fine,4.5,stone,100,currencyPerPoke,stone,500,,,,cooldownDivider,,,rarityOddsDivider,1,basic,,,,,,,,,,,,,level,10,flatCurrencyPerPoke,stone,5000,,,,,,Obsidian was prized by ancient cultures for making razor-sharp blades.,0,0,1
115,Fossil Fragment,1,fine,2.5,stone,25,currencyPerPoke,stone,250,currencyPerSec,stone,15,rarityOddsDivider,1,basic,rarityOddsDivider,1,decent,,,,,,,,,,,,,,,,,,,,,,,Fossils can reveal creatures that roamed Earth over 65 million years ago.,0,0,1
116,Ruby Geode,1,fine,2,stone,20,currencyPerPoke,stone,200,,,,rarityOddsDivider,1,junk,rarityOddsDivider,1,basic,rarityOddsDivider,1,decent,rarityOddsDivider,1,fine,,,,,,,,,,,,,,,,,Geodes form when minerals deposit inside gas bubbles in rocks over eons.,0,0,1
117,Emerald Deposit,1,fine,4.5,rune,10,currencyPerPoke,stone,500,,,,cooldownDivider,,,rarityOddsDivider,1,junk,rarityOddsDivider,1,basic,rarityOddsDivider,1,decent,,,,,,,,,,,,,,,,,Emeralds get their green from trace chromium and vanadium.,0,0,1
118,Sapphire Stone,1,fine,2,stone,100,currencyPerPoke,rune,3,,,,rarityOddsDivider,1,junk,rarityOddsDivider,1,basic,rarityOddsDivider,1,decent,,,,,,,,,,,,,,,,,,,,Sapphires come in many colors—even pink and yellow!,0,0,1
119,Meteorite,1,fine,2,stone,500,,,,currencyPerSec,stone,15,rarityOddsDivider,1,junk,rarityOddsDivider,1,basic,rarityOddsDivider,1,decent,,,,,,,,,,level,20,allGeneratorMultiplier,1.25,,,,,,,Meteorites can be up to 4.5 billion years old—older than Earth!,0,0,1
120,Ancient Relic,1,rare,2.5,rune,1,currencyPerPoke,rune,5,currencyPerSec,rune,1,rarityOddsDivider,1,decent,rarityOddsDivider,1,basic,rarityOddsDivider,1,junk,rarityOddsDivider,2,decent,rarityOddsDivider,5,basic,rarityOddsDivider,5,junk,level,10,flatCurrencyPerPoke,rune,250,tier,8,currencyPerSecMultiplier,stone,2,Many ancient relics are carbon-dated to reveal secrets of past civilizations.,0,0,1
201,Seaweed,2,junk,1.5,coral,5,currencyPerPoke,coral,1,,,,,,,,,,,,,,,,,,,,,,,,,,,,,,,,Seaweed produces about 80% of Earth’s oxygen through photosynthesis.,0,0,1
202,Seashell,2,junk,1.5,coral,5,currencyPerPoke,coral,1,,,,,,,,,,,,,,,,,,,,,,,,,,,,,,,,Many seashell shapes follow the Fibonacci sequence in nature.,0,0,1
203,Starfish,2,junk,5,coral,5,currencyPerPoke,coral,1,,,,cooldownDivider,,,,,,,,,,,,,,,,,,,,,,,,,,,,Starfish can regenerate lost arms—even grow a whole new body from one arm.,0,0,1
204,Driftwood,2,junk,2.5,coral,25,,,,currencyPerSec,coral,1,rarityOddsDivider,2,junk,,,,,,,,,,,,,,,,,,,,,,,,,,"Driftwood can float for years, carried across entire oceans.",0,0,1
205,Old Boot,2,junk,2,coral,50,currencyPerPoke,coral,1,,,,rarityOddsDivider,1,junk,rarityOddsDivider,2,junk,,,,,,,,,,,,,,,,,,,,,,,Ancient footwear found in rivers helps archaeologists date human settlements.,0,0,1
206,Coral Fragment,2,basic,2,coral,40,currencyPerPoke,coral,10,,,,rarityOddsDivider,1,junk,rarityOddsDivider,1,basic,,,,,,,,,,,,,,,,,,,,,,,Coral reefs support 25% of all marine species while covering less than 1% of the ocean.,0,0,1
207,Jellyfish,2,basic,5,coral,100,,,,currencyPerSec,coral,4,cooldownDivider,,,rarityOddsDivider,2,junk,,,,,,,,,,,,,,,,,,,,,,,"Some jellyfish species are biologically immortal, reverting to juvenile form to avoid death.",0,0,1
208,Shipwreck,2,basic,2,coral,50,currencyPerPoke,coral,10,,,,rarityOddsDivider,2,junk,rarityOddsDivider,2,basic,,,,,,,,,,,,,,,,,,,,,,,"Over 3 million shipwrecks lie on the ocean floor, preserving maritime history.",0,0,1
209,Lobster,2,decent,2,coral,100,currencyPerPoke,coral,50,,,,rarityOddsDivider,2,junk,rarityOddsDivider,2,basic,rarityOddsDivider,2,decent,,,,,,,,,,,,,,,,,,,,Lobsters taste with their legs and chew with their stomachs!,0,0,1
210,Seahorse,2,decent,2.5,coral,25,currencyPerPoke,coral,40,currencyPerSec,coral,5,rarityOddsDivider,2,basic,,,,,,,,,,,,,,,,,,,,,,,,,,Male seahorses carry and give birth to their young.,0,0,1
211,Clownfish,2,decent,5,coral,200,currencyPerPoke,coral,100,currencyPerSec,coral,5,minCardsPerPoke,,,maxCardsPerPoke,,,,,,,,,,,,,,,tier,6,merchantPriceReduction,0.1,,,,,,,Clownfish live among anemones and are immune to their stinging cells.,0,0,1
212,Swordfish,2,fine,4.5,coral,300,currencyPerPoke,coral,400,,,,cooldownDivider,,,rarityOddsDivider,2,decent,rarityOddsDivider,2,basic,,,,,,,,,,,,,,,,,,,,Swordfish can swim up to 60 mph—one of the ocean’s fastest predators.,0,0,1
213,Anglerfish,2,fine,2,coral,100,currencyPerPoke,coral,250,,,,rarityOddsDivider,2,junk,rarityOddsDivider,1,junk,,,,,,,,,,,,,,,,,,,,,,,Deep-sea anglerfish use a bioluminescent lure to attract prey in darkness.,0,0,1
214,Electric Eel,2,fine,2,coral,100,currencyPerPoke,coral,250,,,,rarityOddsDivider,1,junk,rarityOddsDivider,1,basic,,,,,,,,,,,,,,,,,,,,,,,Electric eels can generate over 600 volts of electricity to stun prey.,0,0,1
215,Pearl Oyster,2,fine,2,coral,200,currencyPerPoke,pearl,1,,,,rarityOddsDivider,2,junk,rarityOddsDivider,2,basic,,,,,,,,,,,,,level,10,flatCurrencyPerPoke,pearl,100,,,,,,"Pearls form when oysters coat irritants with nacre, creating the gem.",0,0,1
216,Manta Ray,2,fine,5,coral,50,currencyPerPoke,coral,250,,,,maxCardsPerPoke,,,rarityOddsDivider,2,basic,rarityOddsDivider,2,decent,,,,,,,,,,,,,,,,,,,,Manta rays have the largest brain-to-body ratio of any fish.,0,0,1
217,Sunken Idol,2,rare,1.5,coral,10,currencyPerPoke,coral,1000,,,,rarityOddsDivider,1,decent,rarityOddsDivider,2,junk,rarityOddsDivider,2,basic,rarityOddsDivider,2,decent,,,,,,,tier,8,currencyPerSecMultiplier,coral,2,,,,,,Sunken idols often stay pristine underwater for centuries.,0,0,1
218,Kraken Tentacle,2,epic,5,coral,200,currencyPerPoke,coral,7500,,,,minCardsPerPoke,,,maxCardsPerPoke,,,rarityOddsDivider,7,junk,rarityOddsDivider,7,basic,,,,,,,level,10,allGeneratorMultiplier,1.1,,,,,,,Legends of the kraken may have originated from giant squid sightings.,0,0,1
219,Leviathan Scale,2,epic,2,pearl,5,currencyPerPoke,coral,5000,,,,rarityOddsDivider,2,junk,rarityOddsDivider,2,basic,rarityOddsDivider,2,decent,rarityOddsDivider,2,fine,rarityOddsDivider,7,junk,rarityOddsDivider,7,basic,level,10,allGeneratorMultiplier,1.1,,,,,,,The name ‘leviathan’ appears in ancient texts describing sea monsters.,0,0,1
220,Poseidon’s Trident,2,legend,2,pearl,1,currencyPerPoke,pearl,3,currencyPerSec,pearl,1,rarityOddsDivider,2,basic,rarityOddsDivider,2,decent,rarityOddsDivider,2,fine,rarityOddsDivider,2,rare,rarityOddsDivider,5,decent,rarityOddsDivider,5,fine,tier,10,flatCurrencyPerPoke,coral,1000000,level,25,currencyPerPokeMultiplier,coral,2,"The trident symbol is linked to Poseidon, god of the sea.",0,0,1
301,Ant,3,junk,1.5,pollen,5,currencyPerPoke,pollen,1,,,,,,,,,,,,,,,,,,,,,,,,,,,,,,,,Ants can lift objects over 50 times their body weight.,0,0,1
302,Beetle,3,junk,1.5,pollen,5,currencyPerPoke,pollen,1,,,,,,,,,,,,,,,,,,,,,,,,,,,,,,,,Beetles make up about 40% of all known insect species.,0,0,1
303,Grasshopper,3,junk,2.5,pollen,25,,,,currencyPerSec,pollen,1,rarityOddsDivider,3,junk,,,,,,,,,,,,,,,,,,,,,,,,,,Some grasshoppers can jump over 20 times their body length.,0,0,1
304,Butterfly,3,basic,2.5,pollen,25,,,,currencyPerSec,pollen,2,rarityOddsDivider,3,junk,rarityOddsDivider,3,basic,rarityOddsDivider,1,junk,rarityOddsDivider,1,basic,,,,,,,tier,5,flatCurrencyPerPoke,pollen,690,,,,,,Butterflies taste with their feet to find host plants.,0,0,1
305,Spider,3,basic,5,pollen,200,currencyPerPoke,pollen,25,,,,cooldownDivider,,,rarityOddsDivider,3,junk,,,,,,,,,,,,,,,,,,,,,,,Spider silk is stronger than steel of the same thickness.,0,0,1
306,Caterpillar,3,basic,2,pollen,50,currencyPerPoke,pollen,10,,,,rarityOddsDivider,1,junk,rarityOddsDivider,1,basic,rarityOddsDivider,2,junk,,,,,,,,,,,,,,,,,,,,Caterpillars can increase their body mass up to 100 times before metamorphosis.,0,0,1
307,Ladybug,3,basic,5,pollen,50,currencyPerPoke,pollen,25,,,,maxCardsPerPoke,,,rarityOddsDivider,3,junk,rarityOddsDivider,3,basic,,,,,,,,,,,,,,,,,,,,Ladybugs release a yellow fluid from their legs to deter predators.,0,0,1
308,Wasp,3,decent,4.5,pollen,200,currencyPerPoke,pollen,75,,,,cooldownDivider,,,rarityOddsDivider,1,decent,rarityOddsDivider,3,decent,,,,,,,,,,tier,6,merchantPriceReduction,0.1,,,,,,,Wasps inspired medical adhesives that work on wet surfaces.,0,0,1
309,Dragonfly,3,decent,2.5,pollen,25,,,,currencyPerSec,pollen,2,rarityOddsDivider,2,junk,rarityOddsDivider,2,basic,,,,,,,,,,,,,,,,,,,,,,,Dragonflies can reach flying speeds of 35 mph—among the fastest insects.,0,0,1
310,Firefly,3,decent,2,pollen,50,currencyPerPoke,pollen,50,,,,rarityOddsDivider,3,junk,rarityOddsDivider,3,basic,,,,,,,,,,,,,,,,,,,,,,,Fireflies glow without heat using a chemical reaction in their abdomen.,0,0,1
311,Honeycomb,3,decent,2,pollen,50,currencyPerPoke,pollen,50,,,,rarityOddsDivider,2,junk,rarityOddsDivider,3,junk,,,,,,,,,,,,,tier,4,flatCurrencyPerSecond,pollen,2000,,,,,,Hexagonal honeycomb cells store the most honey with zero waste.,0,0,1
312,Beetle Carapace,3,fine,2,pollen,80,currencyPerPoke,pollen,250,,,,rarityOddsDivider,3,junk,rarityOddsDivider,3,basic,,,,,,,,,,,,,,,,,,,,,,,Beetle shells inspired new lightweight armor materials.,0,0,1
313,Mantis Claw,3,fine,4.5,pollen,200,,,,currencyPerSec,pollen,2,cooldownDivider,,,rarityOddsDivider,2,basic,rarityOddsDivider,3,basic,,,,,,,,,,,,,,,,,,,,Praying mantis claws strike at over 50 mph to catch prey.,0,0,1
314,Cicada Shell,3,fine,2,pollen,80,currencyPerPoke,pollen,250,,,,rarityOddsDivider,3,junk,rarityOddsDivider,3,basic,,,,,,,,,,,,,,,,,,,,,,,Cicadas emerge in synchronized broods every 13 or 17 years.,0,0,1
315,Termite Wood,3,fine,2.5,pollen,25,currencyPerPoke,pollen,250,currencyPerSec,pollen,3,rarityOddsDivider,2,junk,rarityOddsDivider,2,basic,,,,,,,,,,,,,,,,,,,,,,,Termite mounds maintain constant temperature and humidity inside their tunnels.,0,0,1
316,Queen Bee,3,rare,2,pollen,50,currencyPerPoke,pollen,1000,,,,rarityOddsDivider,3,basic,rarityOddsDivider,2,basic,rarityOddsDivider,2,junk,,,,,,,,,,,,,,,,,,,,A queen bee can lay over 2 000 eggs per day at peak season.,0,0,1
317,Praying Mantis,3,rare,2,pollen,50,currencyPerPoke,pollen,1000,,,,rarityOddsDivider,3,junk,rarityOddsDivider,3,basic,rarityOddsDivider,3,decent,,,,,,,,,,,,,,,,,,,,Praying mantises can rotate their heads 180° to scan for prey.,0,0,1
318,Atlas Moth,3,rare,4,pollen,200,,,,currencyPerSec,pollen,15,cooldownDivider,,,rarityOddsDivider,2,decent,rarityOddsDivider,2,fine,,,,,,,,,,,,,,,,,,,,Atlas moths have wingspans up to 12 inches—among the largest insects.,0,0,1
319,Goliath Beetle,3,rare,2.5,pollen,50,currencyPerPoke,pollen,1500,currencyPerSec,pollen,10,rarityOddsDivider,3,junk,rarityOddsDivider,2,junk,,,,,,,,,,,,,,,,,,,,,,,"Goliath beetles can grow over 4 inches long, making them one of the largest insects.",0,0,1
320,Ant Queen,3,rare,2,pollen,20,currencyPerPoke,pollen,1000,,,,rarityOddsDivider,3,junk,rarityOddsDivider,3,basic,rarityOddsDivider,3,decent,,,,,,,,,,,,,,,,,,,,Ant queens can live for decades—far longer than worker ants.,0,0,1
321,Titan Scarab,3,epic,2,royal_jelly,10,currencyPerPoke,pollen,5000,,,,rarityOddsDivider,3,junk,rarityOddsDivider,3,basic,rarityOddsDivider,3,decent,rarityOddsDivider,3,fine,,,,,,,tier,5,flatCurrencyPerPoke,royal_jelly,5000,,,,,,Titan scarabs can roll dung balls over 1 000× their own weight.,0,0,1
322,Warden Wasp,3,epic,5,royal_jelly,1,currencyPerPoke,royal_jelly,4,,,,maxCardsPerPoke,,,rarityOddsDivider,3,rare,rarityOddsDivider,3,fine,rarityOddsDivider,3,decent,rarityOddsDivider,2,decent,,,,,,,,,,,,,,Warden wasps defend their colonies with some of the strongest insect stings.,0,0,1
323,Celestial Cicada,3,epic,2,royal_jelly,1,currencyPerPoke,royal_jelly,1,,,,rarityOddsDivider,3,fine,rarityOddsDivider,2,fine,rarityOddsDivider,3,rare,rarityOddsDivider,2,rare,,,,,,,,,,,,,,,,,Celestial cicadas emerge in synchronized swarms once every century.,0,0,1
324,Dreamspinner,3,legend,5,royal_jelly,10,currencyPerPoke,royal_jelly,10,currencyPerSec,royal_jelly,1,minCardsPerPoke,,,rarityOddsDivider,3,basic,rarityOddsDivider,3,decent,rarityOddsDivider,3,fine,rarityOddsDivider,6,basic,rarityOddsDivider,6,decent,tier,10,currencyPerSecMultiplier,pollen,3,level,25,flatCurrencyPerSecond,royal_jelly,10000,The Dreamspinner weaves silk that unlocks visions in your dreams.,0,0,1
401,Sparrow,4,basic,1.5,egg,10,currencyPerPoke,egg,5,,,,,,,,,,,,,,,,,,,,,,,,,,,,,,,,Sparrows can swim short distances by flapping their wings and hopping across the water.,0,0,1
402,Pigeon,4,basic,1.5,egg,10,currencyPerPoke,egg,5,,,,,,,,,,,,,,,,,,,,,,,,,,,,,,,,Pigeons can recognize themselves in mirrors—one of the few species with this ability.,0,0,1
403,Crow,4,basic,2.5,egg,25,,,,currencyPerSec,egg,2,,,,,,,,,,,,,,,,,,,,,,,,,,,,,Crows remember human faces and can hold grudges for years.,0,0,1
404,Robin,4,basic,2,egg,40,currencyPerPoke,egg,10,,,,rarityOddsDivider,4,basic,,,,,,,,,,,,,,,,,,,,,,,,,,Robins can hear worms moving underground using their keen sense of hearing.,0,0,1
405,Blue Jay,4,basic,5,egg,40,currencyPerPoke,egg,15,,,,cooldownDivider,,,rarityOddsDivider,4,basic,,,,,,,,,,,,,,,,,,,,,,,Blue Jays mimic the calls of hawks to scare away other birds.,0,0,1
406,Goldfinch,4,basic,1.5,egg,50,currencyPerPoke,egg,5,,,,rarityOddsDivider,2,basic,,,,,,,,,,,,,,,,level,40,currencyPerPokeMultiplier,egg,1.25,,,,,,"Goldfinches are strict vegetarians, unlike most other birds.",0,0,1
407,Hummingbird,4,decent,4.5,egg,200,currencyPerPoke,egg,50,,,,cooldownDivider,,,rarityOddsDivider,1,junk,rarityOddsDivider,1,basic,rarityOddsDivider,2,junk,rarityOddsDivider,2,basic,,,,,,,,,,,,,,Hummingbirds can flap their wings over 70 times per second.,0,0,1
408,Woodpecker,4,decent,2,egg,100,currencyPerPoke,egg,25,,,,rarityOddsDivider,4,basic,rarityOddsDivider,2,junk,,,,,,,,,,,,,,,,,,,,,,,Woodpeckers have specially adapted skulls to absorb the shock of pecking.,0,0,1
409,Kingfisher,4,decent,2.5,egg,25,,,,currencyPerSec,egg,5,rarityOddsDivider,3,basic,,,,,,,,,,,,,,,,,,,,,,,,,,Kingfishers can dive into water without making a splash thanks to their streamlined beaks.,0,0,1
410,Parrot,4,decent,5,egg,100,currencyPerPoke,egg,50,,,,minCardsPerPoke,,,maxCardsPerPoke,,,,,,,,,,,,,,,tier,6,merchantPriceReduction,0.1,,,,,,,Parrots can learn to say over 100 words and use them in context.,0,0,1
411,Flamingo,4,fine,4.5,egg,200,currencyPerPoke,egg,400,,,,cooldownDivider,,,rarityOddsDivider,3,decent,rarityOddsDivider,2,junk,,,,,,,,,,,,,,,,,,,,Flamingos get their pink color from the shrimp and algae they eat.,0,0,1
412,Swan,4,fine,2,egg,200,currencyPerPoke,egg,250,,,,rarityOddsDivider,3,junk,rarityOddsDivider,4,basic,rarityOddsDivider,4,decent,,,,,,,,,,,,,,,,,,,,Swans have more neck vertebrae than giraffes—up to 25!,0,0,1
413,Pelican,4,fine,1.5,egg,50,currencyPerPoke,egg,200,,,,rarityOddsDivider,4,basic,rarityOddsDivider,3,junk,rarityOddsDivider,2,basic,,,,,,,,,,,,,,,,,,,,Pelicans can hold up to 3 gallons of water in their throat pouches.,0,0,1
414,Albatross,4,rare,5,egg,150,,,,currencyPerSec,egg,5,minCardsPerPoke,,,maxCardsPerPoke,,,rarityOddsDivider,2,junk,rarityOddsDivider,2,basic,,,,,,,,,,,,,,,,,Albatrosses can sleep while flying over the ocean.,0,0,1
415,Falcon,4,rare,2,egg,50,currencyPerPoke,egg,1000,,,,rarityOddsDivider,4,basic,rarityOddsDivider,4,decent,rarityOddsDivider,4,fine,,,,,,,,,,,,,,,,,,,,"Falcons are the fastest animals on Earth, diving at speeds over 200 mph.",0,0,1
416,Hawk,4,rare,2,egg,100,currencyPerPoke,egg,1000,,,,rarityOddsDivider,3,junk,rarityOddsDivider,3,basic,,,,,,,,,,,,,tier,3,flatCurrencyPerSecond,egg,500,,,,,,Hawks have vision about 8 times sharper than that of humans.,0,0,1
417,Eagle,4,rare,4,egg,50,currencyPerPoke,egg,1500,,,,cooldownDivider,,,rarityOddsDivider,3,decent,rarityOddsDivider,2,junk,,,,,,,,,,,,,,,,,,,,"Eagles build the largest nests of any bird, sometimes weighing over a ton.",0,0,1
418,Owl,4,rare,2,egg,50,currencyPerPoke,egg,1000,,,,rarityOddsDivider,4,basic,rarityOddsDivider,4,decent,rarityOddsDivider,3,junk,rarityOddsDivider,3,decent,,,,,,,,,,,,,,,,,Owls can rotate their heads up to 270 degrees.,0,0,1
419,Condor,4,rare,2,egg,25,currencyPerPoke,egg,1000,,,,rarityOddsDivider,4,basic,rarityOddsDivider,3,basic,rarityOddsDivider,2,basic,rarityOddsDivider,1,basic,,,,,,,,,,,,,,,,,"Condors have a wingspan of over 10 feet, among the largest of any land bird.",0,0,1
420,Phoenix,4,epic,2,feather,5,currencyPerPoke,feather,1,,,,rarityOddsDivider,4,fine,rarityOddsDivider,4,basic,rarityOddsDivider,4,decent,rarityOddsDivider,4,fine,,,,,,,,,,,,,,,,,Phoenixes are mythical birds said to be reborn from their ashes.,0,0,1
421,Thunderbird,4,epic,5,feather,10,,,,currencyPerSec,egg,25,minCardsPerPoke,,,rarityOddsDivider,3,decent,rarityOddsDivider,3,fine,,,,,,,,,,level,10,allGeneratorMultiplier,1.5,,,,,,,Thunderbirds are legendary creatures said to cause thunder with their wings.,0,0,1
422,Roc,4,epic,5,feather,5,currencyPerPoke,egg,7500,,,,maxCardsPerPoke,,,rarityOddsDivider,4,fine,rarityOddsDivider,4,rare,,,,,,,,,,,,,,,,,,,,Rocs are giant birds in mythology capable of carrying off elephants.,0,0,1
423,Garuda,4,epic,4,feather,10,,,,currencyPerSec,egg,25,cooldownDivider,,,rarityOddsDivider,2,basic,rarityOddsDivider,2,decent,rarityOddsDivider,2,fine,rarityOddsDivider,4,basic,,,,,,,,,,,,,,"Garuda is a divine bird in Hindu mythology, often seen as a protector.",0,0,1
424,Simurgh,4,epic,2,feather,10,currencyPerPoke,egg,5000,,,,rarityOddsDivider,4,basic,rarityOddsDivider,4,decent,rarityOddsDivider,4,fine,rarityOddsDivider,4,rare,,,,,,,,,,,,,,,,,The Simurgh is a Persian mythical bird believed to purify the land and sky.,0,0,1
425,Articuno,4,legend,5,feather,25,currencyPerPoke,feather,25,currencyPerSec,feather,1,maxCardsPerPoke,,,rarityOddsDivider,4,basic,rarityOddsDivider,4,decent,rarityOddsDivider,7,junk,rarityOddsDivider,2,fine,rarityOddsDivider,2,rare,tier,5,currencyPerPokeMultiplier,egg,2,tier,10,currencyPerSecMultiplier,egg,3,Articuno is an Ice-type Legendary Pokémon inspired by arctic birds.,0,0,1
426,Zapdos,4,legend,5,feather,25,currencyPerPoke,feather,25,currencyPerSec,egg,100,cooldownDivider,,,maxCardsPerPoke,,,rarityOddsDivider,4,decent,rarityOddsDivider,4,fine,rarityOddsDivider,7,basic,rarityOddsDivider,3,fine,tier,5,currencyPerPokeMultiplier,egg,2,tier,10,currencyPerSecMultiplier,egg,3,Zapdos is an Electric-type Legendary Pokémon with powers over storms.,0,0,1
427,Moltres,4,legend,2.5,feather,25,currencyPerPoke,egg,25000,currencyPerSec,feather,1,rarityOddsDivider,1,junk,rarityOddsDivider,2,junk,rarityOddsDivider,3,junk,rarityOddsDivider,3,basic,rarityOddsDivider,4,basic,rarityOddsDivider,7,decent,tier,5,currencyPerPokeMultiplier,egg,2,tier,10,currencyPerSecMultiplier,egg,3,Moltres is a Fire-type Legendary Pokémon with wings of flame.,0,0,1
501,Quill Pen,5,junk,1.5,crystal,10,currencyPerPoke,crystal,1,,,,,,,,,,,,,,,,,,,,,,,,,,,,,,,,Writing tools like these were essential for scribes across ancient civilizations.,0,0,1
502,Parchment Scroll,5,junk,2,crystal,10,currencyPerPoke,crystal,1,,,,rarityOddsDivider,1,junk,rarityOddsDivider,1,basic,,,,,,,,,,,,,,,,,,,,,,,Ancient texts were often recorded on parchment made from animal skins.,0,0,1
503,Ink Vial,5,junk,2,rune,1,currencyPerPoke,crystal,1,,,,rarityOddsDivider,5,junk,,,,,,,,,,,,,,,,,,,,,,,,,,Some ancient inks used soot or crushed berries for pigmentation.,0,0,1
504,Wax Seal,5,junk,2,rune,1,currencyPerPoke,crystal,1,,,,rarityOddsDivider,5,junk,,,,,,,,,,,,,,,,,,,,,,,,,,Wax seals were used to authenticate important documents.,0,0,1
505,Candle Stub,5,junk,2.5,crystal,10,,,,currencyPerSec,crystal,1,rarityOddsDivider,1,junk,rarityOddsDivider,1,basic,,,,,,,,,,,,,,,,,,,,,,,Candles were among the earliest portable sources of light.,0,0,1
506,Crystal Lens,5,basic,1.5,crystal,50,currencyPerPoke,crystal,10,,,,rarityOddsDivider,5,junk,,,,,,,,,,,,,,,,,,,,,,,,,,The first lenses were made from naturally transparent crystals.,0,0,1
507,Bronze Compass,5,basic,1.5,crystal,50,currencyPerPoke,crystal,10,,,,rarityOddsDivider,5,junk,,,,,,,,,,,,,,,,,,,,,,,,,,Compasses helped ancient sailors navigate the seas.,0,0,1
508,Rune Stone,5,basic,2,rune,5,currencyPerPoke,crystal,25,,,,rarityOddsDivider,5,basic,rarityOddsDivider,1,basic,,,,,,,,,,,,,level,10,flatCurrencyPerPoke,rune,25,,,,,,Rune stones were used to record significant events and messages.,0,0,1
509,Spell Tome,5,basic,2,rune,5,currencyPerPoke,crystal,25,,,,rarityOddsDivider,5,basic,rarityOddsDivider,1,basic,,,,,,,,,,,,,,,,,,,,,,,Ancient tomes were believed to contain powerful magical knowledge.,0,0,1
510,Alchemist’s Flask,5,basic,2.5,rune,10,,,,currencyPerSec,crystal,10,rarityOddsDivider,5,junk,rarityOddsDivider,5,basic,,,,,,,,,,,,,,,,,,,,,,,Alchemists sought to turn lead into gold using tools like this.,0,0,1
511,Sorcerer’s Ring,5,decent,2,crystal,20,currencyPerPoke,crystal,50,,,,rarityOddsDivider,5,junk,rarityOddsDivider,5,basic,rarityOddsDivider,5,decent,,,,,,,,,,tier,3,flatCurrencyPerSecond,crystal,1000,,,,,,Mythical rings were thought to grant invisibility or control over elements.,0,0,1
512,Enchanted Mirror,5,decent,2,crystal,20,currencyPerPoke,crystal,50,,,,rarityOddsDivider,5,junk,rarityOddsDivider,5,basic,rarityOddsDivider,1,basic,rarityOddsDivider,1,decent,,,,,,,,,,,,,,,,,Some cultures believed mirrors could trap or reveal spirits.,0,0,1
513,Mystic Amulet,5,decent,2.5,rune,10,,,,currencyPerSec,crystal,20,rarityOddsDivider,1,junk,rarityOddsDivider,2,junk,rarityOddsDivider,3,junk,,,,,,,,,,tier,6,merchantPriceReduction,0.1,,,,,,,Amulets were worn to protect the wearer from evil forces.,0,0,1
514,Elemental Orb,5,fine,5,rune,10,currencyPerPoke,crystal,400,,,,maxCardsPerPoke,,,rarityOddsDivider,5,junk,rarityOddsDivider,5,basic,,,,,,,,,,,,,,,,,,,,"Orbs were symbols of power, representing elemental control.",0,0,1
515,Astral Prism,5,fine,4.5,rune,10,currencyPerPoke,crystal,300,,,,cooldownDivider,,,rarityOddsDivider,5,basic,rarityOddsDivider,5,decent,,,,,,,,,,,,,,,,,,,,Prisms symbolized enlightenment and celestial understanding.,0,0,1
516,Celestial Globe,5,rare,1.5,rune,50,currencyPerPoke,rune,5,,,,rarityOddsDivider,5,junk,rarityOddsDivider,5,junk,rarityOddsDivider,4,basic,rarityOddsDivider,3,junk,,,,,,,,,,,,,,,,,Globes mapped the stars and aided early astronomy.,0,0,1
517,Philosopher’s Stone,5,rare,1.5,rune,50,currencyPerPoke,crystal,1000,,,,rarityOddsDivider,5,junk,rarityOddsDivider,4,basic,rarityOddsDivider,3,junk,rarityOddsDivider,5,rare,,,,,,,,,,,,,,,,,Said to grant immortality and turn metals to gold.,0,0,1
518,Excalibur,5,rare,4,rune,50,,,,currencyPerSec,crystal,25,rarityOddsDivider,5,junk,rarityOddsDivider,2,junk,rarityOddsDivider,1,junk,rarityOddsDivider,5,rare,,,,,,,,,,,,,,,,,"The legendary sword of King Arthur, bestowed by the Lady of the Lake.",0,0,1
